{
  "schema_version": 1,
  "revision": 1,
  "generated_at": "2026-01-01T00:00:00Z",
  "mode": "light",
  "wallpaper": "",
  "colors": {
    "primary": "#33aa77",
    "on_primary": "#111111",
    "primary_container": "#223344",
    "on_primary_container": "#223344",
    "secondary": "#223344",
    "on_secondary": "#223344",
    "secondary_container": "#223344",
    "on_secondary_container": "#223344",
    "tertiary": "#223344",
    "on_tertiary": "#223344",
    "tertiary_container": "#223344",
    "on_tertiary_container": "#223344",
    "surface": "#fafafa",
    "on_surface": "#161616",
    "surface_variant": "#223344",
    "on_surface_variant": "#223344",
    "surface_dim": "#223344",
    "surface_bright": "#223344",
    "surface_container_lowest": "#223344",
    "surface_container_low": "#223344",
    "surface_container": "#223344",
    "surface_container_high": "#223344",
    "surface_container_highest": "#223344",
    "outline": "#223344",
    "outline_variant": "#223344",
    "error": "#223344",
    "on_error": "#223344",
    "error_container": "#223344",
    "on_error_container": "#223344",
    "inverse_surface": "#223344",
    "inverse_on_surface": "#223344",
    "inverse_primary": "#223344",
    "background": "#223344",
    "on_background": "#223344",
    "shadow": "#223344",
    "scrim": "#223344",
    "primary_fixed": "#223344",
    "primary_fixed_dim": "#223344",
    "on_primary_fixed": "#223344",
    "on_primary_fixed_variant": "#223344",
    "secondary_fixed": "#223344",
    "secondary_fixed_dim": "#223344",
    "on_secondary_fixed": "#223344",
    "on_secondary_fixed_variant": "#223344",
    "tertiary_fixed": "#223344",
    "tertiary_fixed_dim": "#223344",
    "on_tertiary_fixed": "#223344",
    "on_tertiary_fixed_variant": "#223344",
    "hover": "#33aa77",
    "on_hover": "#111111",
    "terminal_normal_black": "#161616",
    "terminal_normal_red": "#161616",
    "terminal_normal_green": "#161616",
    "terminal_normal_yellow": "#161616",
    "terminal_normal_blue": "#161616",
    "terminal_normal_magenta": "#161616",
    "terminal_normal_cyan": "#161616",
    "terminal_normal_white": "#161616",
    "terminal_bright_black": "#161616",
    "terminal_bright_red": "#161616",
    "terminal_bright_green": "#161616",
    "terminal_bright_yellow": "#161616",
    "terminal_bright_blue": "#161616",
    "terminal_bright_magenta": "#161616",
    "terminal_bright_cyan": "#161616",
    "terminal_bright_white": "#161616",
    "terminal_cursor": "#161616",
    "terminal_cursor_text": "#161616",
    "terminal_background": "#161616",
    "terminal_foreground": "#161616",
    "terminal_selection_fg": "#161616",
    "terminal_selection_bg": "#161616"
  }
}
