{
  "schema_version": 1,
  "revision": 1,
  "generated_at": "2026-01-01T00:00:00Z",
  "mode": "dark",
  "wallpaper": "",
  "colors": {
    "primary": "#bb88dd",
    "on_primary": "#111111",
    "primary_container": "#223344",
    "on_primary_container": "#223344",
    "secondary": "#223344",
    "on_secondary": "#223344",
    "secondary_container": "#223344",
    "on_secondary_container": "#223344",
    "tertiary": "#223344",
    "on_tertiary": "#223344",
    "tertiary_container": "#223344",
    "on_tertiary_container": "#223344",
    "surface": "#151515",
    "on_surface": "#eeeeee",
    "surface_variant": "#223344",
    "on_surface_variant": "#223344",
    "surface_dim": "#223344",
    "surface_bright": "#223344",
    "surface_container_lowest": "#223344",
    "surface_container_low": "#223344",
    "surface_container": "#223344",
    "surface_container_high": "#223344",
    "surface_container_highest": "#223344",
    "outline": "#223344",
    "outline_variant": "#223344",
    "error": "#223344",
    "on_error": "#223344",
    "error_container": "#223344",
    "on_error_container": "#223344",
    "inverse_surface": "#223344",
    "inverse_on_surface": "#223344",
    "inverse_primary": "#223344",
    "background": "#223344",
    "on_background": "#223344",
    "shadow": "#223344",
    "scrim": "#223344",
    "primary_fixed": "#223344",
    "primary_fixed_dim": "#223344",
    "on_primary_fixed": "#223344",
    "on_primary_fixed_variant": "#223344",
    "secondary_fixed": "#223344",
    "secondary_fixed_dim": "#223344",
    "on_secondary_fixed": "#223344",
    "on_secondary_fixed_variant": "#223344",
    "tertiary_fixed": "#223344",
    "tertiary_fixed_dim": "#223344",
    "on_tertiary_fixed": "#223344",
    "on_tertiary_fixed_variant": "#223344",
    "hover": "#bb88dd",
    "on_hover": "#111111",
    "terminal_normal_black": "#eeeeee",
    "terminal_normal_red": "#eeeeee",
    "terminal_normal_green": "#eeeeee",
    "terminal_normal_yellow": "#eeeeee",
    "terminal_normal_blue": "#eeeeee",
    "terminal_normal_magenta": "#eeeeee",
    "terminal_normal_cyan": "#eeeeee",
    "terminal_normal_white": "#eeeeee",
    "terminal_bright_black": "#eeeeee",
    "terminal_bright_red": "#eeeeee",
    "terminal_bright_green": "#eeeeee",
    "terminal_bright_yellow": "#eeeeee",
    "terminal_bright_blue": "#eeeeee",
    "terminal_bright_magenta": "#eeeeee",
    "terminal_bright_cyan": "#eeeeee",
    "terminal_bright_white": "#eeeeee",
    "terminal_cursor": "#eeeeee",
    "terminal_cursor_text": "#eeeeee",
    "terminal_background": "#eeeeee",
    "terminal_foreground": "#eeeeee",
    "terminal_selection_fg": "#eeeeee",
    "terminal_selection_bg": "#eeeeee"
  }
}
